{
  "experiment_id": "saline-multitrial-v1",
  "channel_medium": "0.9% saline",
  "electrode_type": "inert_baseline",
  "electrode_spacing_mm": 20,
  "pulse_voltage_v": 0.2,
  "pulse_width_ms": 100,
  "symbol_period_ms": 500,
  "preamble_bits": "1010",
  "payload_bits": "11001100",
  "crc_mode": "CRC-16/CCITT-FALSE",
  "decode_threshold_mv": 25.0,
  "trials": 3,
  "timestamp_seed_utc": "2026-04-02T12:00:00Z",
  "trial_spacing_seconds": 60,
  "symbol_spacing_seconds": 1,
  "noise_schedule_mv": [0.0, -10.0, -30.0]
}
